{
  "schema_version": 1,
  "generated_at_utc": "2026-10-28T11:08:57.712222+00:00",
  "source": {
    "url": "https://github.com/lightgbm-org/LightGBM",
    "commit": "5d84f3f222b41409a6983d2ac90513ad9702fa9e",
    "version": "4.7.0.99",
    "tree": "a9b83f5afaecffbbccfc1a043d519bac6b6b25c8",
    "license": "MIT",
    "license_file": "references/LightGBM/LICENSE",
    "license_sha256": "ca70f15d841f7e76c8bbd284d25300cd4ae2ef1035e7e5252b13b73449464305"
  },
  "license_provenance": {
    "notice_file": "THIRD_PARTY_NOTICES.md",
    "upstream_license_sha256": "ca70f15d841f7e76c8bbd284d25300cd4ae2ef1035e7e5252b13b73449464305"
  },
  "precision": {
    "label_t": "f32",
    "weight_t": "f32",
    "score_t": "f32",
    "hist_t": "f64",
    "prediction_t": "f64",
    "macros": {
      "SCORE_T_USE_DOUBLE": false,
      "LABEL_T_USE_DOUBLE": false
    }
  },
  "execution": {
    "device": "cpu",
    "histogram_mode": "force_col_wise",
    "deterministic": true,
    "threads": 1,
    "seeds": {
      "seed": 0,
      "data_random_seed": 0,
      "feature_fraction_seed": 0,
      "bagging_seed": 0,
      "drop_seed": 0,
      "extra_seed": 0,
      "objective_seed": 0
    },
    "rng_fixture_seeds": [
      0,
      1,
      42
    ]
  },
  "build": {
    "compiler": {
      "path": "/usr/bin/clang++",
      "sha256": "b8763cf250e607a778bb4603cecb5b90338814d0a3dfcba0d57b1de242f610e9",
      "version": "Apple clang version 21.0.0 (clang-2100.3.34.2)\nTarget: arm64-apple-darwin25.6.0\nThread model: posix\nInstalledDir: /Library/Developer/CommandLineTools/usr/bin",
      "selected_toolchain_path": "/Library/Developer/CommandLineTools/usr/bin/clang",
      "selected_toolchain_sha256": "1590ac950a3d627817d09ade5cb60b2115f17a72182a3141e010b4bcc482a0c9"
    },
    "cmake_version": "cmake version 3.31.6",
    "ninja_version": "1.11.1.git.kitware.jobserver-1",
    "configure_flags": [
      "-G",
      "Ninja",
      "-DCMAKE_BUILD_TYPE=Release",
      "-DCMAKE_EXPORT_COMPILE_COMMANDS=ON",
      "-DCMAKE_CXX_COMPILER=/usr/bin/clang++",
      "-DCMAKE_C_COMPILER=/usr/bin/clang",
      "-DCMAKE_LIBRARY_OUTPUT_DIRECTORY=/Users/narumi/src/lightgbm-rust/target/oracle/lib",
      "-DUSE_OPENMP=OFF",
      "-DUSE_GPU=OFF",
      "-DUSE_CUDA=OFF",
      "-DUSE_ROCM=OFF",
      "-DUSE_MPI=OFF",
      "-DUSE_HOMEBREW_FALLBACK=OFF",
      "-DBUILD_CLI=OFF",
      "-DBUILD_CPP_TEST=OFF"
    ],
    "compile_commands_sha256": "2b28f43e9325eda7c4a91c811cc3059dd145b10731ef92cc009ac12d06652a49",
    "representative_compile_command": "/usr/bin/clang++ -DEIGEN_DONT_PARALLELIZE -DEIGEN_MPL2_ONLY -DMM_MALLOC -DUSE_SOCKET -I/Users/narumi/src/lightgbm-rust/references/LightGBM/external_libs/eigen -I/Users/narumi/src/lightgbm-rust/references/LightGBM/external_libs/fast_double_parser/include -I/Users/narumi/src/lightgbm-rust/references/LightGBM/external_libs/fmt/include -I/Users/narumi/src/lightgbm-rust/references/LightGBM/include -I/Users/narumi/src/lightgbm-rust/references/LightGBM/external_libs/nanoarrow/src -I/Users/narumi/src/lightgbm-rust/target/oracle/build/external_libs/nanoarrow/src  -pthread -Wextra -Wall -Wno-ignored-attributes -Wno-unknown-pragmas -Wno-return-type -O3 -Wno-unknown-pragmas -Wno-unused-private-field -fPIC -funroll-loops -O3 -DNDEBUG -std=gnu++17 -arch arm64 -isysroot /Library/Developer/CommandLineTools/SDKs/MacOSX27.0.sdk -mmacosx-version-min=26.6 -fvisibility=hidden -fvisibility-inlines-hidden -o CMakeFiles/lightgbm_objs.dir/src/boosting/boosting.cpp.o -c /Users/narumi/src/lightgbm-rust/references/LightGBM/src/boosting/boosting.cpp",
    "openmp": false,
    "gpu": false,
    "cuda": false,
    "rocm": false,
    "mpi": false
  },
  "loaded_library": {
    "path": "/Users/narumi/src/lightgbm-rust/target/oracle/lib/lib_lightgbm.dylib",
    "sha256": "9ed1d46d2d60bac2966fd03bd81e7d192025804f6a3e3ef24c3aa483d0ec7c1e",
    "loaded_path": "/Users/narumi/src/lightgbm-rust/target/oracle/lib/lib_lightgbm.dylib",
    "loaded_sha256": "9ed1d46d2d60bac2966fd03bd81e7d192025804f6a3e3ef24c3aa483d0ec7c1e",
    "verification": "dladdr(LGBM_GetLastError) + SHA-256",
    "linked_libraries": [
      "/Users/narumi/src/lightgbm-rust/target/oracle/lib/lib_lightgbm.dylib:",
      "\t@rpath/lib_lightgbm.dylib (compatibility version 0.0.0, current version 0.0.0)",
      "\t/usr/lib/libc++.1.dylib (compatibility version 1.0.0, current version 2200.27.0)",
      "\t/usr/lib/libSystem.B.dylib (compatibility version 1.0.0, current version 1359.0.0)"
    ]
  },
  "driver": {
    "compile_command": [
      "/usr/bin/clang++",
      "-DEIGEN_DONT_PARALLELIZE",
      "-DEIGEN_MPL2_ONLY",
      "-DMM_MALLOC",
      "-DUSE_SOCKET",
      "-I/Users/narumi/src/lightgbm-rust/references/LightGBM/external_libs/eigen",
      "-I/Users/narumi/src/lightgbm-rust/references/LightGBM/external_libs/fast_double_parser/include",
      "-I/Users/narumi/src/lightgbm-rust/references/LightGBM/external_libs/fmt/include",
      "-I/Users/narumi/src/lightgbm-rust/references/LightGBM/include",
      "-I/Users/narumi/src/lightgbm-rust/references/LightGBM/external_libs/nanoarrow/src",
      "-I/Users/narumi/src/lightgbm-rust/target/oracle/build/external_libs/nanoarrow/src",
      "-pthread",
      "-Wextra",
      "-Wall",
      "-Wno-ignored-attributes",
      "-Wno-unknown-pragmas",
      "-Wno-return-type",
      "-O0",
      "-Wno-unknown-pragmas",
      "-Wno-unused-private-field",
      "-fPIC",
      "-funroll-loops",
      "-O0",
      "-DNDEBUG",
      "-std=gnu++17",
      "-arch",
      "arm64",
      "-isysroot",
      "/Library/Developer/CommandLineTools/SDKs/MacOSX27.0.sdk",
      "-mmacosx-version-min=26.6",
      "-fvisibility=hidden",
      "-fvisibility-inlines-hidden",
      "-o",
      "/Users/narumi/src/lightgbm-rust/target/oracle/primitive_driver.o",
      "-c",
      "/Users/narumi/src/lightgbm-rust/tools/oracle/primitive_driver.cpp",
      "-I/Users/narumi/src/lightgbm-rust/references/LightGBM",
      "-I/Users/narumi/src/lightgbm-rust/target/oracle"
    ],
    "link_command": [
      "/usr/bin/clang++",
      "-DEIGEN_DONT_PARALLELIZE",
      "-DEIGEN_MPL2_ONLY",
      "-DMM_MALLOC",
      "-DUSE_SOCKET",
      "-I/Users/narumi/src/lightgbm-rust/references/LightGBM/external_libs/eigen",
      "-I/Users/narumi/src/lightgbm-rust/references/LightGBM/external_libs/fast_double_parser/include",
      "-I/Users/narumi/src/lightgbm-rust/references/LightGBM/external_libs/fmt/include",
      "-I/Users/narumi/src/lightgbm-rust/references/LightGBM/include",
      "-I/Users/narumi/src/lightgbm-rust/references/LightGBM/external_libs/nanoarrow/src",
      "-I/Users/narumi/src/lightgbm-rust/target/oracle/build/external_libs/nanoarrow/src",
      "-pthread",
      "-Wextra",
      "-Wall",
      "-Wno-ignored-attributes",
      "-Wno-unknown-pragmas",
      "-Wno-return-type",
      "-O0",
      "-Wno-unknown-pragmas",
      "-Wno-unused-private-field",
      "-fPIC",
      "-funroll-loops",
      "-O0",
      "-DNDEBUG",
      "-std=gnu++17",
      "-arch",
      "arm64",
      "-isysroot",
      "/Library/Developer/CommandLineTools/SDKs/MacOSX27.0.sdk",
      "-mmacosx-version-min=26.6",
      "-fvisibility=hidden",
      "-fvisibility-inlines-hidden",
      "/Users/narumi/src/lightgbm-rust/target/oracle/primitive_driver.o",
      "/Users/narumi/src/lightgbm-rust/target/oracle/build/CMakeFiles/lightgbm_objs.dir/src/boosting/boosting.cpp.o",
      "/Users/narumi/src/lightgbm-rust/target/oracle/build/CMakeFiles/lightgbm_objs.dir/src/boosting/gbdt.cpp.o",
      "/Users/narumi/src/lightgbm-rust/target/oracle/build/CMakeFiles/lightgbm_objs.dir/src/boosting/gbdt_model_text.cpp.o",
      "/Users/narumi/src/lightgbm-rust/target/oracle/build/CMakeFiles/lightgbm_objs.dir/src/boosting/gbdt_prediction.cpp.o",
      "/Users/narumi/src/lightgbm-rust/target/oracle/build/CMakeFiles/lightgbm_objs.dir/src/boosting/prediction_early_stop.cpp.o",
      "/Users/narumi/src/lightgbm-rust/target/oracle/build/CMakeFiles/lightgbm_objs.dir/src/boosting/sample_strategy.cpp.o",
      "/Users/narumi/src/lightgbm-rust/target/oracle/build/CMakeFiles/lightgbm_objs.dir/src/io/bin.cpp.o",
      "/Users/narumi/src/lightgbm-rust/target/oracle/build/CMakeFiles/lightgbm_objs.dir/src/io/config.cpp.o",
      "/Users/narumi/src/lightgbm-rust/target/oracle/build/CMakeFiles/lightgbm_objs.dir/src/io/config_auto.cpp.o",
      "/Users/narumi/src/lightgbm-rust/target/oracle/build/CMakeFiles/lightgbm_objs.dir/src/io/dataset.cpp.o",
      "/Users/narumi/src/lightgbm-rust/target/oracle/build/CMakeFiles/lightgbm_objs.dir/src/io/dataset_loader.cpp.o",
      "/Users/narumi/src/lightgbm-rust/target/oracle/build/CMakeFiles/lightgbm_objs.dir/src/io/file_io.cpp.o",
      "/Users/narumi/src/lightgbm-rust/target/oracle/build/CMakeFiles/lightgbm_objs.dir/src/io/json11.cpp.o",
      "/Users/narumi/src/lightgbm-rust/target/oracle/build/CMakeFiles/lightgbm_objs.dir/src/io/metadata.cpp.o",
      "/Users/narumi/src/lightgbm-rust/target/oracle/build/CMakeFiles/lightgbm_objs.dir/src/io/parser.cpp.o",
      "/Users/narumi/src/lightgbm-rust/target/oracle/build/CMakeFiles/lightgbm_objs.dir/src/io/train_share_states.cpp.o",
      "/Users/narumi/src/lightgbm-rust/target/oracle/build/CMakeFiles/lightgbm_objs.dir/src/io/tree.cpp.o",
      "/Users/narumi/src/lightgbm-rust/target/oracle/build/CMakeFiles/lightgbm_objs.dir/src/metric/dcg_calculator.cpp.o",
      "/Users/narumi/src/lightgbm-rust/target/oracle/build/CMakeFiles/lightgbm_objs.dir/src/metric/metric.cpp.o",
      "/Users/narumi/src/lightgbm-rust/target/oracle/build/CMakeFiles/lightgbm_objs.dir/src/network/linker_topo.cpp.o",
      "/Users/narumi/src/lightgbm-rust/target/oracle/build/CMakeFiles/lightgbm_objs.dir/src/network/linkers_mpi.cpp.o",
      "/Users/narumi/src/lightgbm-rust/target/oracle/build/CMakeFiles/lightgbm_objs.dir/src/network/linkers_socket.cpp.o",
      "/Users/narumi/src/lightgbm-rust/target/oracle/build/CMakeFiles/lightgbm_objs.dir/src/network/network.cpp.o",